{
  "$schema": "http://json-schema.org/draft-07/schema#",
  "type": "object",
  "properties": {
    "pr": {
      "type": "object",
      "description": "Raw metadata output from gh pr view --json"
    },
    "ci": {
      "type": "object",
      "properties": {
        "isRunning": {
          "type": "boolean"
        },
        "hasFailures": {
          "type": "boolean"
        },
        "totalCheckCount": {
          "type": "integer"
        },
        "securityCheckCount": {
          "type": "integer"
        },
        "nonSecurityCheckCount": {
          "type": "integer"
        },
        "checkNames": {
          "type": "array",
          "items": {
            "type": "string"
          }
        },
        "signalQuality": {
          "type": "string"
        },
        "degradedReasons": {
          "type": "array",
          "items": {
            "type": "string"
          }
        },
        "requiredChecksKnown": {
          "type": "boolean"
        },
        "requiredChecks": {
          "type": "array",
          "items": {
            "type": "string"
          }
        },
        "missingRequiredChecks": {
          "type": "array",
          "items": {
            "type": "string"
          }
        },
        "failedChecks": {
          "type": "array",
          "items": {
            "type": "object",
            "properties": {
              "name": {
                "type": "string"
              },
              "state": {
                "type": "string"
              },
              "url": {
                "type": "string"
              }
            }
          }
        }
      },
      "required": [
        "isRunning",
        "hasFailures",
        "failedChecks",
        "totalCheckCount",
        "securityCheckCount",
        "nonSecurityCheckCount",
        "checkNames",
        "signalQuality",
        "degradedReasons",
        "requiredChecksKnown",
        "requiredChecks",
        "missingRequiredChecks"
      ]
    },
    "commentsFetch": {
      "type": "object",
      "properties": {
        "succeeded": {
          "type": "boolean"
        },
        "source": {
          "type": "string"
        }
      },
      "required": [
        "succeeded",
        "source"
      ]
    },
    "commentsSummary": {
      "type": "object",
      "properties": {
        "classificationVersion": {
          "type": "integer"
        },
        "total": {
          "type": "integer"
        },
        "reviewCommentCount": {
          "type": "integer"
        },
        "issueCommentCount": {
          "type": "integer"
        },
        "reviewBodyCount": {
          "type": "integer"
        },
        "actionableCommentCount": {
          "type": "integer"
        },
        "includeBotReviewComments": {
          "type": "boolean"
        },
        "humanCommentCount": {
          "type": "integer"
        },
        "botCommentCount": {
          "type": "integer"
        },
        "hasActionableComments": {
          "type": "boolean"
        },
        "actionableCommentIds": {
          "type": "array",
          "items": {}
        },
        "nonActionableReasonCounts": {
          "type": "object",
          "additionalProperties": {
            "type": "integer"
          }
        },
        "classifiedComments": {
          "type": "array",
          "items": {
            "type": "object",
            "properties": {
              "id": {},
              "type": {
                "type": [
                  "string",
                  "null"
                ]
              },
              "user": {
                "type": [
                  "string",
                  "null"
                ]
              },
              "url": {
                "type": [
                  "string",
                  "null"
                ]
              },
              "path": {
                "type": [
                  "string",
                  "null"
                ]
              },
              "line": {
                "type": [
                  "integer",
                  "null"
                ]
              },
              "actionable": {
                "type": "boolean"
              },
              "reason": {
                "type": "string"
              }
            },
            "required": [
              "actionable",
              "reason"
            ]
          }
        },
        "deferredCommentIds": {
          "type": "array",
          "items": {
            "type": [
              "integer",
              "string"
            ]
          }
        },
        "hasDeferredComments": {
          "type": "boolean"
        }
      },
      "required": [
        "classificationVersion",
        "total",
        "reviewCommentCount",
        "issueCommentCount",
        "reviewBodyCount",
        "actionableCommentCount",
        "includeBotReviewComments",
        "humanCommentCount",
        "botCommentCount",
        "hasActionableComments",
        "actionableCommentIds",
        "nonActionableReasonCounts",
        "classifiedComments"
      ]
    },
    "comments": {
      "type": "array",
      "items": {
        "type": "object"
      }
    },
    "repository": {
      "type": "string"
    },
    "progressSignature": {
      "type": "string",
      "description": "Stable signature of head SHA + outstanding actionable/deferred comment IDs. Consumed by the owning gate to detect no-progress cycles."
    },
    "automatedReview": {
      "type": "object",
      "description": "Portable evidence about the configured automated reviewer for the current head SHA.",
      "properties": {
        "enabled": {
          "type": "boolean"
        },
        "provider": {
          "type": "string"
        },
        "command": {
          "type": "string"
        },
        "reviewerLogins": {
          "type": "array",
          "items": {
            "type": "string"
          }
        },
        "headSha": {
          "type": "string"
        },
        "freshReviewForHead": {
          "type": "boolean"
        },
        "requestPending": {
          "type": "boolean"
        },
        "requestFailed": {
          "type": "boolean",
          "description": "The provider refused the current-head request and no review completion superseded that refusal. Omitted by older snapshots and when the review loop is disabled."
        },
        "requestFailure": {
          "type": [
            "object",
            "null"
          ],
          "description": "Evidence for the provider's refusal, or null when the request has not failed. Omitted by older snapshots and when the review loop is disabled.",
          "properties": {
            "kind": {
              "type": "string",
              "enum": [
                "issue_comment"
              ]
            },
            "id": {
              "type": [
                "integer",
                "null"
              ]
            },
            "failedAt": {
              "type": "string",
              "minLength": 1
            },
            "providerErrorClass": {
              "type": "string",
              "minLength": 1,
              "description": "Provider failure classification, such as rate_limit."
            }
          },
          "required": [
            "kind",
            "id",
            "failedAt",
            "providerErrorClass"
          ]
        },
        "requestCommentId": {
          "type": [
            "integer",
            "null"
          ]
        },
        "requestedAt": {
          "type": [
            "string",
            "null"
          ]
        },
        "headCommittedAt": {
          "type": [
            "string",
            "null"
          ]
        },
        "completionKind": {
          "type": [
            "string",
            "null"
          ]
        },
        "completionId": {
          "type": [
            "integer",
            "null"
          ]
        },
        "completedAt": {
          "type": [
            "string",
            "null"
          ]
        },
        "reason": {
          "type": "string"
        },
        "latestProviderReview": {
          "type": "object"
        }
      },
      "required": [
        "enabled"
      ]
    }
  },
  "required": [
    "pr",
    "ci",
    "commentsFetch",
    "comments",
    "commentsSummary"
  ]
}
