{
  "pr": {
    "baseRefName": "main",
    "headRefName": "118-style-proposals-page",
    "headRefOid": "7fe0ee1256103287752c848e46e3b858446fad6b",
    "isDraft": false,
    "mergeStateStatus": "CLEAN",
    "mergeable": "MERGEABLE",
    "number": 1092,
    "reviewDecision": "",
    "state": "OPEN",
    "statusCheckRollup": [
      {
        "__typename": "CheckRun",
        "completedAt": "2026-03-30T22:02:30Z",
        "conclusion": "SUCCESS",
        "detailsUrl": "https://github.com/MoonLadderStudios/MoonMind/actions/runs/23769858733/job/69258485212",
        "name": "Analyze (javascript-typescript)",
        "startedAt": "2026-03-30T22:01:39Z",
        "status": "COMPLETED",
        "workflowName": "CodeQL"
      },
      {
        "__typename": "CheckRun",
        "completedAt": "2026-03-30T22:02:24Z",
        "conclusion": "SUCCESS",
        "detailsUrl": "https://github.com/MoonLadderStudios/MoonMind/actions/runs/23769858776/job/69258484895",
        "name": "Analyze (actions)",
        "startedAt": "2026-03-30T22:01:39Z",
        "status": "COMPLETED",
        "workflowName": "CodeQL"
      },
      {
        "__typename": "CheckRun",
        "completedAt": "2026-03-30T22:03:29Z",
        "conclusion": "SUCCESS",
        "detailsUrl": "https://github.com/MoonLadderStudios/MoonMind/actions/runs/23769858733/job/69258485227",
        "name": "Analyze (python)",
        "startedAt": "2026-03-30T22:01:39Z",
        "status": "COMPLETED",
        "workflowName": "CodeQL"
      },
      {
        "__typename": "CheckRun",
        "completedAt": "2026-03-30T22:02:48Z",
        "conclusion": "SUCCESS",
        "detailsUrl": "https://github.com/MoonLadderStudios/MoonMind/actions/runs/23769858776/job/69258484872",
        "name": "Analyze (javascript-typescript)",
        "startedAt": "2026-03-30T22:01:39Z",
        "status": "COMPLETED",
        "workflowName": "CodeQL"
      },
      {
        "__typename": "CheckRun",
        "completedAt": "2026-03-30T22:02:44Z",
        "conclusion": "SUCCESS",
        "detailsUrl": "https://github.com/MoonLadderStudios/MoonMind/actions/runs/23769858776/job/69258484871",
        "name": "Analyze (python)",
        "startedAt": "2026-03-30T22:01:39Z",
        "status": "COMPLETED",
        "workflowName": "CodeQL"
      },
      {
        "__typename": "CheckRun",
        "completedAt": "2026-03-30T22:02:16Z",
        "conclusion": "SUCCESS",
        "detailsUrl": "https://github.com/MoonLadderStudios/MoonMind/runs/69258558359",
        "name": "CodeQL",
        "startedAt": "2026-03-30T22:02:14Z",
        "status": "COMPLETED",
        "workflowName": ""
      }
    ],
    "title": "UI: Style Proposals Page",
    "url": "https://github.com/MoonLadderStudios/MoonMind/pull/1092"
  },
  "ci": {
    "isRunning": false,
    "hasFailures": true,
    "failedChecks": [
      {
        "name": "CI signal continuity",
        "state": "MISSING_NON_SECURITY_CHECKS_ON_HEAD",
        "url": ""
      }
    ],
    "totalCheckCount": 6,
    "securityCheckCount": 6,
    "nonSecurityCheckCount": 0,
    "checkNames": [
      "Analyze (javascript-typescript)",
      "Analyze (actions)",
      "Analyze (python)",
      "Analyze (javascript-typescript)",
      "Analyze (python)",
      "CodeQL"
    ],
    "signalQuality": "degraded",
    "degradedReasons": [
      "head_missing_non_security_checks_seen_on_previous_commit"
    ],
    "requiredChecksKnown": false,
    "requiredChecks": [],
    "missingRequiredChecks": [],
    "headShaVerified": "7fe0ee1256103287752c848e46e3b858446fad6b",
    "headShaNonSecurityCheckCount": 0,
    "previousCommitSha": "307d76c5f4c7dafb346680ce689b9e715fba126e",
    "previousCommitNonSecurityCheckCount": 3
  },
  "commentsFetch": {
    "succeeded": true,
    "source": ".agents/skills/fix-comments/tools/get_branch_pr_comments.py"
  },
  "comments": [
    {
      "type": "review",
      "id": 4033499887,
      "user": "gemini-code-assist[bot]",
      "state": "COMMENTED",
      "body": "## Code Review\n\nThis pull request refactors the Proposals page to implement custom cursor-based pagination, filtering by status and repository, and URL state synchronization. The changes replace the previous DataTable with a more flexible dual-layout (table and cards) and update the data schemas. Review feedback identifies issues with the 'All States' filter persistence, the lack of pagination state in the URL which causes UI resets on refresh, and the need for debouncing the repository search input to prevent excessive API calls.",
      "created_at": "2026-03-30T21:55:59Z",
      "updated_at": "2026-03-30T21:55:59Z",
      "url": "https://github.com/MoonLadderStudios/MoonMind/pull/1092#pullrequestreview-4033499887"
    },
    {
      "type": "review_comment",
      "id": 3012388615,
      "user": "gemini-code-assist[bot]",
      "body": "![medium](https://www.gstatic.com/codereviewagent/medium-priority.svg)\n\nThe current initialization logic prevents the 'All States' filter (represented by an empty string) from persisting across page refreshes. Since `initial.get('status')` returns `\"\"` when the parameter is present but empty, the `|| 'open'` fallback incorrectly resets it to `'open'`. \n\nTo fix this, check for `null` explicitly during initialization and update the `syncUrl` logic to include the status in the URL whenever it differs from the default ('open').\n\n```suggestion\n  const [status, setStatus] = useState(() => {\n    const fromUrl = initial.get('status');\n    return fromUrl !== null ? fromUrl : 'open';\n  });\n```",
      "created_at": "2026-03-30T21:56:00Z",
      "updated_at": "2026-03-30T21:56:00Z",
      "url": "https://github.com/MoonLadderStudios/MoonMind/pull/1092#discussion_r3012388615",
      "path": "frontend/src/entrypoints/proposals.tsx",
      "commit_id": "859c633b159ba413a239a5716dce658ffefb403a",
      "in_reply_to_id": null,
      "line": null,
      "side": "RIGHT",
      "thread_resolved": false,
      "thread_outdated": true
    },
    {
      "type": "review_comment",
      "id": 3012388626,
      "user": "gemini-code-assist[bot]",
      "body": "![medium](https://www.gstatic.com/codereviewagent/medium-priority.svg)\n\nIn conjunction with the status initialization fix, the URL synchronization should explicitly set the status parameter even if it is an empty string (representing 'All States'), to ensure it overrides the backend's default 'open' filter upon refresh.\n\n```suggestion\n    if (status !== 'open') params.set('status', status);\n```",
      "created_at": "2026-03-30T21:56:00Z",
      "updated_at": "2026-03-30T21:56:00Z",
      "url": "https://github.com/MoonLadderStudios/MoonMind/pull/1092#discussion_r3012388626",
      "path": "frontend/src/entrypoints/proposals.tsx",
      "commit_id": "859c633b159ba413a239a5716dce658ffefb403a",
      "in_reply_to_id": null,
      "line": null,
      "side": "RIGHT",
      "thread_resolved": false,
      "thread_outdated": true
    },
    {
      "type": "review_comment",
      "id": 3012388630,
      "user": "gemini-code-assist[bot]",
      "body": "![medium](https://www.gstatic.com/codereviewagent/medium-priority.svg)\n\nThe pagination labels ('Page X', 'Items Y-Z') rely on `cursorStack`, which is not persisted in the URL. Consequently, if a user refreshes the page or shares a link to a specific cursor, the UI will incorrectly display 'Page 1' and '1-50' regardless of the actual position in the result set. Consider persisting the page index in the URL or adjusting the labels to be relative when the stack is empty but a cursor is present.",
      "created_at": "2026-03-30T21:56:00Z",
      "updated_at": "2026-03-30T21:56:00Z",
      "url": "https://github.com/MoonLadderStudios/MoonMind/pull/1092#discussion_r3012388630",
      "path": "frontend/src/entrypoints/proposals.tsx",
      "commit_id": "7fe0ee1256103287752c848e46e3b858446fad6b",
      "in_reply_to_id": null,
      "line": 121,
      "side": "RIGHT",
      "thread_resolved": false,
      "thread_outdated": false
    },
    {
      "type": "review_comment",
      "id": 3012388634,
      "user": "gemini-code-assist[bot]",
      "body": "![medium](https://www.gstatic.com/codereviewagent/medium-priority.svg)\n\nThe repository filter triggers a network request on every keystroke, which can lead to excessive API load and potential race conditions. It is recommended to debounce this input so that the query only triggers after the user has stopped typing for a short duration (e.g., 300ms).",
      "created_at": "2026-03-30T21:56:00Z",
      "updated_at": "2026-03-30T21:56:00Z",
      "url": "https://github.com/MoonLadderStudios/MoonMind/pull/1092#discussion_r3012388634",
      "path": "frontend/src/entrypoints/proposals.tsx",
      "commit_id": "7fe0ee1256103287752c848e46e3b858446fad6b",
      "in_reply_to_id": null,
      "line": 209,
      "side": "RIGHT",
      "thread_resolved": false,
      "thread_outdated": false
    },
    {
      "type": "review_comment",
      "id": 3012391279,
      "user": "Copilot",
      "body": "TaskPreviewSchema requires `repository`, but the UI never reads `taskPreview.repository` (it uses `row.repository`). If the API omits `repository` inside `taskPreview` (common for 'preview' payloads), Zod parsing will fail and the page will show an error. Make `taskPreview.repository` optional/nullable or remove it from the schema unless it is guaranteed by the API.",
      "created_at": "2026-03-30T21:56:47Z",
      "updated_at": "2026-03-30T21:56:49Z",
      "url": "https://github.com/MoonLadderStudios/MoonMind/pull/1092#discussion_r3012391279",
      "path": "frontend/src/entrypoints/proposals.tsx",
      "commit_id": "7fe0ee1256103287752c848e46e3b858446fad6b",
      "in_reply_to_id": null,
      "line": 19,
      "side": "RIGHT",
      "thread_resolved": false,
      "thread_outdated": false
    },
    {
      "type": "review_comment",
      "id": 3012391297,
      "user": "Copilot",